{
  "schema_version": "gbparse.mobilome.v1",
  "tool": "gbparse",
  "analysis": "mobilome",
  "tool_version": "0.7.0",
  "catalog_version": "1.3.0",
  "inference_version": "1.3.0",
  "input": {
    "file": "mobilome_evidence.gb",
    "sha256": "34d9908260fc17c0a199c17c4494d608b99219bfaa2411983ad45f77d86957fc"
  },
  "parameters": {
    "include": "all",
    "min_evidence": 1,
    "database_source": "packaged"
  },
  "provenance": {
    "resources": [
      {
        "name": "markers.yaml",
        "sha256": "8fbb601d81f4a85b16d07e6cedb608960b6643bb980f49c6aa0313701d65942f"
      },
      {
        "name": "provenance.yaml",
        "sha256": "cc4b96f7dd2269e8ba523d78165af57347517739c500241fa4ec6d75f44ed967"
      },
      {
        "name": "inference.yaml",
        "sha256": "d81d55b20fbceb570e7e90c604998b1536ab3db2f081a7513974a4a1dfe8b376"
      },
      {
        "name": "report.schema.json",
        "sha256": "3fc311ec2b2b3dde46bd81d161b3315579eb0666899fef5894d5aeec6ed90013"
      }
    ],
    "annotation_pipelines": [
      {
        "record_indices": [
          1
        ],
        "name": null,
        "version": null,
        "database_version": null,
        "evidence_fields": [
          "record_annotations"
        ]
      }
    ]
  },
  "summary": {
    "records_scanned": 1,
    "records_reported": 1,
    "raw_hits": 15,
    "eligible_hits": 10,
    "raw_reasons": 26,
    "eligible_reasons": 17,
    "hypotheses": 4
  },
  "inventory": [
    {
      "record_index": 1,
      "record_id": "MOB_EVIDENCE.1",
      "name": "MOB_EVIDENCE",
      "description": "Synthetic typed evidence fixture for mobilome analysis",
      "length": 600,
      "topology": "circular",
      "source_qualifiers": [
        {
          "key": "organism",
          "values": [
            "Synthetic bacterium"
          ]
        },
        {
          "key": "plasmid",
          "values": [
            "pEVIDENCE"
          ]
        }
      ],
      "classification": {
        "label": "plasmid",
        "status": "supported",
        "supporting_evidence": [
          {
            "rule_id": "source_plasmid_qualifier",
            "source": "source_qualifier",
            "field": "plasmid",
            "value": "pEVIDENCE",
            "matched_text": "pEVIDENCE",
            "pattern": "qualifier-present",
            "source_feature_index": 1,
            "interpreted_as": "plasmid",
            "strength": 3,
            "source_ids": [
              "insdc-feature-table"
            ]
          }
        ],
        "conflicting_evidence": [],
        "limitations": []
      },
      "spatial_limitations": [],
      "feature_count": 15,
      "cds_count": 9,
      "pseudo_feature_count": 3,
      "pseudo_cds_count": 2,
      "pseudogene_feature_count": 1
    }
  ],
  "replicons": [
    {
      "inventory": {
        "record_index": 1,
        "record_id": "MOB_EVIDENCE.1",
        "name": "MOB_EVIDENCE",
        "description": "Synthetic typed evidence fixture for mobilome analysis",
        "length": 600,
        "topology": "circular",
        "source_qualifiers": [
          {
            "key": "organism",
            "values": [
              "Synthetic bacterium"
            ]
          },
          {
            "key": "plasmid",
            "values": [
              "pEVIDENCE"
            ]
          }
        ],
        "classification": {
          "label": "plasmid",
          "status": "supported",
          "supporting_evidence": [
            {
              "rule_id": "source_plasmid_qualifier",
              "source": "source_qualifier",
              "field": "plasmid",
              "value": "pEVIDENCE",
              "matched_text": "pEVIDENCE",
              "pattern": "qualifier-present",
              "source_feature_index": 1,
              "interpreted_as": "plasmid",
              "strength": 3,
              "source_ids": [
                "insdc-feature-table"
              ]
            }
          ],
          "conflicting_evidence": [],
          "limitations": []
        },
        "spatial_limitations": [],
        "feature_count": 15,
        "cds_count": 9,
        "pseudo_feature_count": 3,
        "pseudo_cds_count": 2,
        "pseudogene_feature_count": 1
      },
      "hits": [
        {
          "hit_id": "r1:f2:mgeneric_replication_origin",
          "marker_id": "generic_replication_origin",
          "marker_label": "Generic annotated replication origin",
          "facets": [
            "replication_origin"
          ],
          "feature": {
            "record_index": 1,
            "record_id": "MOB_EVIDENCE.1",
            "feature_index": 2,
            "feature_type": "rep_origin",
            "locus_tag": null,
            "gene": null,
            "product": null,
            "start": 10,
            "end": 25,
            "strand": 1,
            "segments": [
              [
                10,
                25
              ]
            ],
            "location_operator": null,
            "biological_length": 16,
            "wraps_origin": false,
            "partial": false,
            "pseudo": false
          },
          "reasons": [
            {
              "reason_id": "r1:f2:mgeneric_replication_origin:feature_type:0:0",
              "field": "feature_type",
              "match_mode": "casefold_exact",
              "matched_value": "rep_origin",
              "matched_text": "rep_origin",
              "pattern": "rep_origin",
              "strength": 3,
              "eligible": true,
              "source_ids": [
                "insdc-feature-table"
              ]
            }
          ],
          "max_strength": 3,
          "eligible_for_inference": true
        },
        {
          "hit_id": "r1:f3:mexplicit_origin_of_transfer",
          "marker_id": "explicit_origin_of_transfer",
          "marker_label": "Explicitly annotated origin of transfer",
          "facets": [
            "mobility_orit"
          ],
          "feature": {
            "record_index": 1,
            "record_id": "MOB_EVIDENCE.1",
            "feature_index": 3,
            "feature_type": "regulatory",
            "locus_tag": null,
            "gene": null,
            "product": null,
            "start": 40,
            "end": 55,
            "strand": 1,
            "segments": [
              [
                40,
                55
              ]
            ],
            "location_operator": null,
            "biological_length": 16,
            "wraps_origin": false,
            "partial": false,
            "pseudo": false
          },
          "reasons": [
            {
              "reason_id": "r1:f3:mexplicit_origin_of_transfer:regulatory_class:1:0",
              "field": "regulatory_class",
              "match_mode": "casefold_exact",
              "matched_value": "oriT",
              "matched_text": "oriT",
              "pattern": "oriT",
              "strength": 3,
              "eligible": true,
              "source_ids": [
                "bakta-origin-docs",
                "insdc-feature-table",
                "schwengers-2021-bakta"
              ]
            }
          ],
          "max_strength": 3,
          "eligible_for_inference": true
        },
        {
          "hit_id": "r1:f4:mrelaxase_candidate",
          "marker_id": "relaxase_candidate",
          "marker_label": "Relaxase annotation candidate",
          "facets": [
            "mobility_relaxase"
          ],
          "feature": {
            "record_index": 1,
            "record_id": "MOB_EVIDENCE.1",
            "feature_index": 4,
            "feature_type": "CDS",
            "locus_tag": "MOB_0001",
            "gene": "mobA",
            "product": "relaxase",
            "start": 70,
            "end": 120,
            "strand": 1,
            "segments": [
              [
                70,
                120
              ]
            ],
            "location_operator": null,
            "biological_length": 51,
            "wraps_origin": false,
            "partial": false,
            "pseudo": false
          },
          "reasons": [
            {
              "reason_id": "r1:f4:mrelaxase_candidate:gene:0:0",
              "field": "gene",
              "match_mode": "casefold_exact",
              "matched_value": "mobA",
              "matched_text": "mobA",
              "pattern": "mobA",
              "strength": 2,
              "eligible": true,
              "source_ids": [
                "garcillan-barcia-2009-relaxases",
                "garcillan-barcia-2025-extended-mobility",
                "smillie-2010-mobility"
              ]
            },
            {
              "reason_id": "r1:f4:mrelaxase_candidate:product:1:0",
              "field": "product",
              "match_mode": "regex",
              "matched_value": "relaxase",
              "matched_text": "relaxase",
              "pattern": "(?i)\\b(?:relaxase|mobility protein)\\b",
              "strength": 2,
              "eligible": true,
              "source_ids": [
                "garcillan-barcia-2009-relaxases",
                "garcillan-barcia-2025-extended-mobility",
                "smillie-2010-mobility"
              ]
            }
          ],
          "max_strength": 2,
          "eligible_for_inference": true
        },
        {
          "hit_id": "r1:f5:mtoxn",
          "marker_id": "toxn",
          "marker_label": "ToxN-family toxin annotation",
          "facets": [
            "ta_toxin"
          ],
          "feature": {
            "record_index": 1,
            "record_id": "MOB_EVIDENCE.1",
            "feature_index": 5,
            "feature_type": "CDS",
            "locus_tag": "MOB_0002",
            "gene": "toxN",
            "product": "ToxN-family toxin",
            "start": 130,
            "end": 180,
            "strand": 1,
            "segments": [
              [
                130,
                180